{"canonicalisation":"psp-json-c14n-1","format":"pareto-support-generation-trace","iterations":[{"iteration":1,"oracle_adapter":"shortest_path_exact_dijkstra_v1","oracle_decision":{"edge_ids":["e0008","e0010","e0012"]},"oracle_gap":"0/1","oracle_outcome":["47","57"],"oracle_proof_type":"shortest_path_potentials_v1","oracle_trust_level":"P1_FULLY_CHECKABLE","pool_size_before":0,"termination":"positive_scalar_optimality","weights":["1/2","1/2"]}],"result":"positive_weight_supportable","schema_version":"1.0.0"}
