{"canonicalisation":"psp-json-c14n-1","format":"pareto-support-generation-trace","iterations":[{"added_difference":["-66","-18","-52"],"added_pool_index":0,"certificate_support":1,"dual_margin":"-18/1","iteration":1,"oracle_adapter":"explicit_enumeration_exact_v1","oracle_decision":{"id":"a007"},"oracle_gap":"-136/3","oracle_outcome":["10","46","3"],"oracle_proof_type":"explicit_enumeration_v1","oracle_trust_level":"P1_FULLY_CHECKABLE","pool_size_after":1,"pool_size_before":0,"restricted_margin":"-18/1","restricted_weights":["0/1","1/1","0/1"],"termination":"negative_sparse_witness","weights":["1/3","1/3","1/3"]}],"result":"nonnegative_weight_unsupported","schema_version":"1.0.0"}
