{"canonicalisation":"psp-json-c14n-1","format":"pareto-support-generation-trace","iterations":[{"iteration":1,"oracle_adapter":"assignment_exact_hungarian_v1","oracle_decision":{"permutation":[0,1,2,3,4,5,6,7,8,9,10,11,12,13,14,15,16,17,18,19,20,21,22,23,24,25,26,27,28,29,30,31,32,33,34,35,36,37,38,39]},"oracle_gap":"0/1","oracle_outcome":["0","0"],"oracle_proof_type":"assignment_primal_dual_v1","oracle_trust_level":"P1_FULLY_CHECKABLE","pool_size_before":0,"termination":"positive_scalar_optimality","weights":["1/2","1/2"]}],"result":"positive_weight_supportable","schema_version":"1.0.0"}
