{"canonicalisation":"psp-json-c14n-1","format":"pareto-support-generation-trace","iterations":[{"iteration":1,"oracle_adapter":"shortest_path_exact_dijkstra_v1","oracle_decision":{"edge_ids":["r0_e0001","r0_e0002","r0_e0003","r0_e0004","r0_e0005","r0_e0006","r0_e0007","r0_e0008","r0_e0009","r0_e0010","r0_e0011","r0_e0012","r0_e0013","r0_e0014","r0_e0015","r0_e0016","r0_e0017","r0_e0018","r0_e0019","r0_e0020","r0_e0021","r0_e0022","r0_e0023","r0_e0024","r0_e0025","r0_e0026","r0_e0027","r0_e0028","r0_e0029","r0_e0030","r0_e0031","r0_e0032","r0_e0033","r0_e0034","r0_e0035","r0_e0036","r0_e0037","r0_e0038","r0_e0039","r0_e0040","r0_e0041","r0_e0042","r0_e0043","r0_e0044","r0_e0045","r0_e0046","r0_e0047","r0_e0048","r0_e0049","r0_e0050","r0_e0051","r0_e0052","r0_e0053","r0_e0054","r0_e0055","r0_e0056","r0_e0057","r0_e0058","r0_e0059","r0_e0060","r0_e0061","r0_e0062","r0_e0063","r0_e0064","r0_e0065","r0_e0066","r0_e0067","r0_e0068","r0_e0069","r0_e0070","r0_e0071","r0_e0072","r0_e0073","r0_e0074","r0_e0075","r0_e0076","r0_e0077","r0_e0078","r0_e0079","r0_e0080","r0_e0081","r0_e0082","r0_e0083","r0_e0084","r0_e0085","r0_e0086","r0_e0087","r0_e0088","r0_e0089","r0_e0090","r0_e0091","r0_e0092","r0_e0093","r0_e0094","r0_e0095","r0_e0096","r0_e0097","r0_e0098","r0_e0099","r0_e0100","r0_e0101","r0_e0102","r0_e0103","r0_e0104","r0_e0105","r0_e0106","r0_e0107","r0_e0108","r0_e0109","r0_e0110","r0_e0111","r0_e0112","r0_e0113","r0_e0114","r0_e0115","r0_e0116","r0_e0117","r0_e0118","r0_e0119","r0_e0120","r0_e0121","r0_e0122","r0_e0123","r0_e0124","r0_e0125","r0_e0126","r0_e0127","r0_e0128","r0_e0129","r0_e0130","r0_e0131","r0_e0132","r0_e0133","r0_e0134","r0_e0135","r0_e0136","r0_e0137","r0_e0138","r0_e0139","r0_e0140","r0_e0141","r0_e0142","r0_e0143","r0_e0144","r0_e0145","r0_e0146","r0_e0147","r0_e0148","r0_e0149","r0_e0150","r0_e0151","r0_e0152","r0_e0153","r0_e0154","r0_e0155","r0_e0156","r0_e0157","r0_e0158","r0_e0159","r0_e0160","r0_e0161","r0_e0162","r0_e0163","r0_e0164","r0_e0165","r0_e0166","r0_e0167","r0_e0168","r0_e0169","r0_e0170","r0_e0171","r0_e0172","r0_e0173","r0_e0174","r0_e0175","r0_e0176","r0_e0177","r0_e0178","r0_e0179","r0_e0180","r0_e0181","r0_e0182","r0_e0183","r0_e0184","r0_e0185","r0_e0186","r0_e0187","r0_e0188","r0_e0189","r0_e0190","r0_e0191","r0_e0192","r0_e0193","r0_e0194","r0_e0195","r0_e0196","r0_e0197","r0_e0198","r0_e0199","r0_e0200","r0_e0201","r0_e0202","r0_e0203","r0_e0204","r0_e0205","r0_e0206","r0_e0207","r0_e0208","r0_e0209","r0_e0210","r0_e0211","r0_e0212","r0_e0213","r0_e0214","r0_e0215","r0_e0216","r0_e0217","r0_e0218","r0_e0219","r0_e0220","r0_e0221","r0_e0222","r0_e0223","r0_e0224","r0_e0225","r0_e0226","r0_e0227","r0_e0228","r0_e0229","r0_e0230","r0_e0231","r0_e0232","r0_e0233","r0_e0234","r0_e0235","r0_e0236","r0_e0237","r0_e0238","r0_e0239","r0_e0240","r0_e0241","r0_e0242","r0_e0243","r0_e0244","r0_e0245","r0_e0246","r0_e0247","r0_e0248","r0_e0249","r0_e0250","r0_e0251","r0_e0252","r0_e0253","r0_e0254","r0_e0255","r0_e0256","r0_e0257","r0_e0258","r0_e0259","r0_e0260","r0_e0261","r0_e0262","r0_e0263","r0_e0264","r0_e0265","r0_e0266","r0_e0267","r0_e0268","r0_e0269","r0_e0270","r0_e0271","r0_e0272","r0_e0273","r0_e0274","r0_e0275","r0_e0276","r0_e0277","r0_e0278","r0_e0279","r0_e0280","r0_e0281","r0_e0282","r0_e0283","r0_e0284","r0_e0285","r0_e0286","r0_e0287","r0_e0288","r0_e0289","r0_e0290","r0_e0291","r0_e0292","r0_e0293","r0_e0294","r0_e0295","r0_e0296","r0_e0297","r0_e0298","r0_e0299","r0_e0300","r0_e0301","r0_e0302","r0_e0303","r0_e0304","r0_e0305","r0_e0306","r0_e0307","r0_e0308","r0_e0309","r0_e0310","r0_e0311","r0_e0312","r0_e0313","r0_e0314","r0_e0315","r0_e0316","r0_e0317","r0_e0318","r0_e0319","r0_e0320","r0_e0321","r0_e0322","r0_e0323","r0_e0324","r0_e0325","r0_e0326","r0_e0327","r0_e0328","r0_e0329","r0_e0330","r0_e0331","r0_e0332","r0_e0333","r0_e0334","r0_e0335","r0_e0336","r0_e0337","r0_e0338","r0_e0339","r0_e0340","r0_e0341","r0_e0342","r0_e0343","r0_e0344","r0_e0345","r0_e0346","r0_e0347","r0_e0348","r0_e0349","r0_e0350","r0_e0351","r0_e0352","r0_e0353","r0_e0354","r0_e0355","r0_e0356","r0_e0357","r0_e0358","r0_e0359","r0_e0360","r0_e0361","r0_e0362","r0_e0363","r0_e0364","r0_e0365","r0_e0366","r0_e0367","r0_e0368","r0_e0369","r0_e0370","r0_e0371","r0_e0372","r0_e0373","r0_e0374","r0_e0375","r0_e0376","r0_e0377","r0_e0378","r0_e0379","r0_e0380","r0_e0381","r0_e0382","r0_e0383","r0_e0384","r0_e0385","r0_e0386","r0_e0387","r0_e0388","r0_e0389","r0_e0390","r0_e0391","r0_e0392","r0_e0393","r0_e0394","r0_e0395","r0_e0396","r0_e0397","r0_e0398","r0_e0399","r0_e0400"]},"oracle_gap":"0/1","oracle_outcome":["26","26"],"oracle_proof_type":"shortest_path_potentials_v1","oracle_trust_level":"P1_FULLY_CHECKABLE","pool_size_before":0,"termination":"positive_scalar_optimality","weights":["1/2","1/2"]}],"result":"positive_weight_supportable","schema_version":"1.0.0"}
