{"canonicalisation":"psp-json-c14n-1","format":"pareto-support-generation-trace","iterations":[{"added_difference":["37","-14","-39"],"added_pool_index":0,"iteration":1,"oracle_adapter":"assignment_exact_hungarian_v1","oracle_decision":{"permutation":[1,2,0,3,4]},"oracle_gap":"-16/3","oracle_outcome":["131","143","131"],"oracle_proof_type":"assignment_primal_dual_v1","oracle_trust_level":"P1_FULLY_CHECKABLE","pool_size_after":1,"pool_size_before":0,"restricted_margin":"37/1","restricted_weights":["1/1","0/1","0/1"],"weights":["1/3","1/3","1/3"]},{"iteration":2,"oracle_adapter":"assignment_exact_hungarian_v1","oracle_decision":{"permutation":[1,3,0,2,4]},"oracle_gap":"0/1","oracle_outcome":["94","157","170"],"oracle_proof_type":"assignment_primal_dual_v1","oracle_trust_level":"P1_FULLY_CHECKABLE","pool_size_before":1,"termination":"positive_scalar_optimality","weights":["1/1","0/1","0/1"]}],"result":"nonnegative_weight_supportable","schema_version":"1.0.0"}
