{"canonicalisation":"psp-json-c14n-1","format":"pareto-support-generation-trace","iterations":[{"added_difference":["999999","-1000001"],"added_pool_index":0,"iteration":1,"oracle_adapter":"explicit_enumeration_exact_v1","oracle_decision":{"id":"lower_cut"},"oracle_gap":"-1/1","oracle_outcome":["2000009","9"],"oracle_proof_type":"explicit_enumeration_v1","oracle_trust_level":"P1_FULLY_CHECKABLE","pool_size_after":1,"pool_size_before":0,"restricted_margin":"999999/1","restricted_weights":["1/1","0/1"],"weights":["1/2","1/2"]},{"added_difference":["-999997","1000003"],"added_pool_index":1,"iteration":2,"oracle_adapter":"explicit_enumeration_exact_v1","oracle_decision":{"id":"upper_cut"},"oracle_gap":"-999997/1","oracle_outcome":["13","2000013"],"oracle_proof_type":"explicit_enumeration_v1","oracle_trust_level":"P1_FULLY_CHECKABLE","pool_size_after":2,"pool_size_before":1,"restricted_margin":"1/1","restricted_weights":["500001/1000000","499999/1000000"],"weights":["1/1","0/1"]},{"iteration":3,"oracle_adapter":"explicit_enumeration_exact_v1","oracle_decision":{"id":"candidate"},"oracle_gap":"0/1","oracle_outcome":["1000010","1000010"],"oracle_proof_type":"explicit_enumeration_v1","oracle_trust_level":"P1_FULLY_CHECKABLE","pool_size_before":2,"termination":"positive_scalar_optimality","weights":["500001/1000000","499999/1000000"]}],"result":"positive_weight_supportable","schema_version":"1.0.0"}
