{"canonicalisation":"psp-json-c14n-1","format":"pareto-support-generation-trace","iterations":[{"added_difference":["-18","12","16","-11"],"added_pool_index":0,"iteration":1,"oracle_adapter":"explicit_enumeration_exact_v1","oracle_decision":{"id":"a001"},"oracle_gap":"-1/4","oracle_outcome":["1","30","55","12"],"oracle_proof_type":"explicit_enumeration_v1","oracle_trust_level":"P1_FULLY_CHECKABLE","pool_size_after":1,"pool_size_before":0,"restricted_margin":"16/1","restricted_weights":["0/1","0/1","1/1","0/1"],"weights":["1/4","1/4","1/4","1/4"]},{"added_difference":["9","19","-39","59"],"added_pool_index":1,"iteration":2,"oracle_adapter":"explicit_enumeration_exact_v1","oracle_decision":{"id":"a002"},"oracle_gap":"-39/1","oracle_outcome":["28","37","0","82"],"oracle_proof_type":"explicit_enumeration_v1","oracle_trust_level":"P1_FULLY_CHECKABLE","pool_size_after":2,"pool_size_before":1,"restricted_margin":"386/31","restricted_weights":["0/1","55/62","7/62","0/1"],"weights":["0/1","0/1","1/1","0/1"]},{"added_difference":["-6","-15","35","-11"],"added_pool_index":2,"iteration":3,"oracle_adapter":"explicit_enumeration_exact_v1","oracle_decision":{"id":"a012"},"oracle_gap":"-290/31","oracle_outcome":["13","3","74","12"],"oracle_proof_type":"explicit_enumeration_v1","oracle_trust_level":"P1_FULLY_CHECKABLE","pool_size_after":3,"pool_size_before":2,"restricted_margin":"7832/1143","restricted_weights":["0/1","665/2286","105/254","338/1143"],"weights":["0/1","55/62","7/62","0/1"]},{"added_difference":["71","13","-20","10"],"added_pool_index":3,"iteration":4,"oracle_adapter":"explicit_enumeration_exact_v1","oracle_decision":{"id":"a005"},"oracle_gap":"-1165/762","oracle_outcome":["90","31","19","33"],"oracle_proof_type":"explicit_enumeration_v1","oracle_trust_level":"P1_FULLY_CHECKABLE","pool_size_after":4,"pool_size_before":3,"restricted_margin":"2215069/406505","restricted_weights":["38318/406505","123977/406505","151977/406505","92233/406505"],"weights":["0/1","665/2286","105/254","338/1143"]},{"iteration":5,"oracle_adapter":"explicit_enumeration_exact_v1","oracle_decision":{"id":"a008"},"oracle_gap":"0/1","oracle_outcome":["19","18","39","23"],"oracle_proof_type":"explicit_enumeration_v1","oracle_trust_level":"P1_FULLY_CHECKABLE","pool_size_before":4,"termination":"positive_scalar_optimality","weights":["38318/406505","123977/406505","151977/406505","92233/406505"]}],"result":"positive_weight_supportable","schema_version":"1.0.0"}
