{"canonicalisation":"psp-json-c14n-1","format":"pareto-support-generation-trace","iterations":[{"added_difference":["-18","-24"],"added_pool_index":0,"certificate_support":1,"dual_margin":"-18/1","iteration":1,"oracle_adapter":"shortest_path_exact_dijkstra_v1","oracle_decision":{"edge_ids":["e0008","e0012"]},"oracle_gap":"-21/1","oracle_outcome":["37","41"],"oracle_proof_type":"shortest_path_potentials_v1","oracle_trust_level":"P1_FULLY_CHECKABLE","pool_size_after":1,"pool_size_before":0,"restricted_margin":"-18/1","restricted_weights":["1/1","0/1"],"termination":"negative_sparse_witness","weights":["1/2","1/2"]}],"result":"nonnegative_weight_unsupported","schema_version":"1.0.0"}
