{"canonicalisation":"psp-json-c14n-1","format":"pareto-support-generation-trace","iterations":[{"added_difference":["-16","-6","5","-88"],"added_pool_index":0,"iteration":1,"oracle_adapter":"assignment_exact_hungarian_v1","oracle_decision":{"permutation":[1,0,3,4,2]},"oracle_gap":"-105/4","oracle_outcome":["188","152","176","134"],"oracle_proof_type":"assignment_primal_dual_v1","oracle_trust_level":"P1_FULLY_CHECKABLE","pool_size_after":1,"pool_size_before":0,"restricted_margin":"5/1","restricted_weights":["0/1","0/1","1/1","0/1"],"weights":["1/4","1/4","1/4","1/4"]},{"added_difference":["66","25","-41","-31"],"added_pool_index":1,"certificate_support":2,"dual_margin":"-11/7","iteration":2,"oracle_adapter":"assignment_exact_hungarian_v1","oracle_decision":{"permutation":[1,0,4,3,2]},"oracle_gap":"-41/1","oracle_outcome":["270","183","130","191"],"oracle_proof_type":"assignment_primal_dual_v1","oracle_trust_level":"P1_FULLY_CHECKABLE","pool_size_after":2,"pool_size_before":1,"restricted_margin":"-11/7","restricted_weights":["0/1","46/77","31/77","0/1"],"termination":"negative_sparse_witness","weights":["0/1","0/1","1/1","0/1"]}],"result":"nonnegative_weight_unsupported","schema_version":"1.0.0"}
