{"canonicalisation":"psp-json-c14n-1","format":"pareto-support-generation-trace","iterations":[{"added_difference":["3","-32"],"added_pool_index":0,"iteration":1,"oracle_adapter":"explicit_enumeration_exact_v1","oracle_decision":{"id":"a022"},"oracle_gap":"-29/2","oracle_outcome":["8","12"],"oracle_proof_type":"explicit_enumeration_v1","oracle_trust_level":"P1_FULLY_CHECKABLE","pool_size_after":1,"pool_size_before":0,"restricted_margin":"3/1","restricted_weights":["1/1","0/1"],"weights":["1/2","1/2"]},{"iteration":2,"oracle_adapter":"explicit_enumeration_exact_v1","oracle_decision":{"id":"a006"},"oracle_gap":"0/1","oracle_outcome":["5","44"],"oracle_proof_type":"explicit_enumeration_v1","oracle_trust_level":"P1_FULLY_CHECKABLE","pool_size_before":1,"termination":"positive_scalar_optimality","weights":["1/1","0/1"]}],"result":"nonnegative_weight_supportable","schema_version":"1.0.0"}
