{"canonicalisation":"psp-json-c14n-1","format":"pareto-support-generation-trace","iterations":[{"added_difference":["-61","-41","-69"],"added_pool_index":0,"certificate_support":1,"dual_margin":"-41/1","iteration":1,"oracle_adapter":"binary_linear_exact_enumeration_reference_v1","oracle_decision":{"bits":"0100101011"},"oracle_gap":"-57/1","oracle_outcome":["-179","-270","-220"],"oracle_proof_type":"trusted_scalar_optimum_assertion_v1","oracle_trust_level":"P2_TRUSTED_ORACLE","pool_size_after":1,"pool_size_before":0,"restricted_margin":"-41/1","restricted_weights":["0/1","1/1","0/1"],"termination":"negative_sparse_witness","weights":["1/3","1/3","1/3"]}],"result":"nonnegative_weight_unsupported","schema_version":"1.0.0"}
