{"canonicalisation":"psp-json-c14n-1","format":"pareto-support-generation-trace","iterations":[{"iteration":1,"oracle_adapter":"explicit_enumeration_exact_v1","oracle_decision":{"id":"a002"},"oracle_gap":"0/1","oracle_outcome":["15","7","2","25"],"oracle_proof_type":"explicit_enumeration_v1","oracle_trust_level":"P1_FULLY_CHECKABLE","pool_size_before":0,"termination":"positive_scalar_optimality","weights":["1/4","1/4","1/4","1/4"]}],"result":"positive_weight_supportable","schema_version":"1.0.0"}
