{"canonicalisation":"psp-json-c14n-1","format":"pareto-support-generation-trace","iterations":[{"added_difference":["-3","1","1"],"added_pool_index":0,"iteration":1,"oracle_adapter":"shortest_path_exact_dijkstra_v1","oracle_decision":{"edge_ids":["r1_e0001","r1_e0002","r1_e0003","r1_e0004","r1_e0005","r1_e0006","r1_e0007","r1_e0008","r1_e0009","r1_e0010","r1_e0011","r1_e0012","r1_e0013","r1_e0014","r1_e0015","r1_e0016","r1_e0017","r1_e0018","r1_e0019","r1_e0020"]},"oracle_gap":"-1/3","oracle_outcome":["26","30","30"],"oracle_proof_type":"shortest_path_potentials_v1","oracle_trust_level":"P1_FULLY_CHECKABLE","pool_size_after":1,"pool_size_before":0,"restricted_margin":"1/1","restricted_weights":["0/1","1/1","0/1"],"weights":["1/3","1/3","1/3"]},{"added_difference":["1","-3","1"],"added_pool_index":1,"iteration":2,"oracle_adapter":"shortest_path_exact_dijkstra_v1","oracle_decision":{"edge_ids":["r2_e0001","r2_e0002","r2_e0003","r2_e0004","r2_e0005","r2_e0006","r2_e0007","r2_e0008","r2_e0009","r2_e0010","r2_e0011","r2_e0012","r2_e0013","r2_e0014","r2_e0015","r2_e0016","r2_e0017","r2_e0018","r2_e0019","r2_e0020"]},"oracle_gap":"-3/1","oracle_outcome":["30","26","30"],"oracle_proof_type":"shortest_path_potentials_v1","oracle_trust_level":"P1_FULLY_CHECKABLE","pool_size_after":2,"pool_size_before":1,"restricted_margin":"1/1","restricted_weights":["0/1","0/1","1/1"],"weights":["0/1","1/1","0/1"]},{"added_difference":["1","1","-3"],"added_pool_index":2,"certificate_support":3,"dual_margin":"-1/3","iteration":3,"oracle_adapter":"shortest_path_exact_dijkstra_v1","oracle_decision":{"edge_ids":["r3_e0001","r3_e0002","r3_e0003","r3_e0004","r3_e0005","r3_e0006","r3_e0007","r3_e0008","r3_e0009","r3_e0010","r3_e0011","r3_e0012","r3_e0013","r3_e0014","r3_e0015","r3_e0016","r3_e0017","r3_e0018","r3_e0019","r3_e0020"]},"oracle_gap":"-3/1","oracle_outcome":["30","30","26"],"oracle_proof_type":"shortest_path_potentials_v1","oracle_trust_level":"P1_FULLY_CHECKABLE","pool_size_after":3,"pool_size_before":2,"restricted_margin":"-1/3","restricted_weights":["1/3","1/3","1/3"],"termination":"negative_sparse_witness","weights":["0/1","0/1","1/1"]}],"result":"nonnegative_weight_unsupported","schema_version":"1.0.0"}
