{"canonicalisation":"psp-json-c14n-1","format":"pareto-support-generation-trace","iterations":[{"iteration":1,"oracle_adapter":"binary_linear_exact_enumeration_reference_v1","oracle_decision":{"bits":"1010011011"},"oracle_gap":"0/1","oracle_outcome":["-261","-260"],"oracle_proof_type":"trusted_scalar_optimum_assertion_v1","oracle_trust_level":"P2_TRUSTED_ORACLE","pool_size_before":0,"termination":"positive_scalar_optimality","weights":["1/2","1/2"]}],"result":"positive_weight_supportable","schema_version":"1.0.0"}
