{"canonicalisation":"psp-json-c14n-1","format":"pareto-support-generation-trace","iterations":[{"added_difference":["-15","-18","55","-31"],"added_pool_index":0,"iteration":1,"oracle_adapter":"binary_linear_exact_enumeration_reference_v1","oracle_decision":{"bits":"0111001110"},"oracle_gap":"-9/4","oracle_outcome":["-242","-204","-167","-245"],"oracle_proof_type":"trusted_scalar_optimum_assertion_v1","oracle_trust_level":"P2_TRUSTED_ORACLE","pool_size_after":1,"pool_size_before":0,"restricted_margin":"55/1","restricted_weights":["0/1","0/1","1/1","0/1"],"weights":["1/4","1/4","1/4","1/4"]},{"added_difference":["39","73","-9","47"],"added_pool_index":1,"iteration":2,"oracle_adapter":"binary_linear_exact_enumeration_reference_v1","oracle_decision":{"bits":"1011100010"},"oracle_gap":"-9/1","oracle_outcome":["-188","-113","-231","-167"],"oracle_proof_type":"trusted_scalar_optimum_assertion_v1","oracle_trust_level":"P2_TRUSTED_ORACLE","pool_size_after":2,"pool_size_before":1,"restricted_margin":"3853/155","restricted_weights":["0/1","64/155","91/155","0/1"],"weights":["0/1","0/1","1/1","0/1"]},{"iteration":3,"oracle_adapter":"binary_linear_exact_enumeration_reference_v1","oracle_decision":{"bits":"1111001010"},"oracle_gap":"0/1","oracle_outcome":["-227","-186","-222","-214"],"oracle_proof_type":"trusted_scalar_optimum_assertion_v1","oracle_trust_level":"P2_TRUSTED_ORACLE","pool_size_before":2,"termination":"positive_scalar_optimality","weights":["0/1","64/155","91/155","0/1"]}],"result":"nonnegative_weight_supportable","schema_version":"1.0.0"}
