{"canonicalisation":"psp-json-c14n-1","format":"pareto-support-generation-trace","iterations":[{"added_difference":["23","-18","-1","-17"],"added_pool_index":0,"iteration":1,"oracle_adapter":"shortest_path_exact_dijkstra_v1","oracle_decision":{"edge_ids":["e0009","e0007"]},"oracle_gap":"-13/4","oracle_outcome":["50","19","40","27"],"oracle_proof_type":"shortest_path_potentials_v1","oracle_trust_level":"P1_FULLY_CHECKABLE","pool_size_after":1,"pool_size_before":0,"restricted_margin":"23/1","restricted_weights":["1/1","0/1","0/1","0/1"],"weights":["1/4","1/4","1/4","1/4"]},{"iteration":2,"oracle_adapter":"shortest_path_exact_dijkstra_v1","oracle_decision":{"edge_ids":["e0008","e0012"]},"oracle_gap":"0/1","oracle_outcome":["27","37","41","44"],"oracle_proof_type":"shortest_path_potentials_v1","oracle_trust_level":"P1_FULLY_CHECKABLE","pool_size_before":1,"termination":"positive_scalar_optimality","weights":["1/1","0/1","0/1","0/1"]}],"result":"nonnegative_weight_supportable","schema_version":"1.0.0"}
