{"canonicalisation":"psp-json-c14n-1","format":"pareto-support-generation-trace","iterations":[{"added_difference":["-4","1","1","1"],"added_pool_index":0,"iteration":1,"oracle_adapter":"explicit_enumeration_exact_v1","oracle_decision":{"id":"challenger_1"},"oracle_gap":"-1/4","oracle_outcome":["3","8","8","8"],"oracle_proof_type":"explicit_enumeration_v1","oracle_trust_level":"P1_FULLY_CHECKABLE","pool_size_after":1,"pool_size_before":0,"restricted_margin":"1/1","restricted_weights":["0/1","1/1","0/1","0/1"],"weights":["1/4","1/4","1/4","1/4"]},{"added_difference":["1","-4","1","1"],"added_pool_index":1,"iteration":2,"oracle_adapter":"explicit_enumeration_exact_v1","oracle_decision":{"id":"challenger_2"},"oracle_gap":"-4/1","oracle_outcome":["8","3","8","8"],"oracle_proof_type":"explicit_enumeration_v1","oracle_trust_level":"P1_FULLY_CHECKABLE","pool_size_after":2,"pool_size_before":1,"restricted_margin":"1/1","restricted_weights":["0/1","0/1","1/1","0/1"],"weights":["0/1","1/1","0/1","0/1"]},{"added_difference":["1","1","-4","1"],"added_pool_index":2,"iteration":3,"oracle_adapter":"explicit_enumeration_exact_v1","oracle_decision":{"id":"challenger_3"},"oracle_gap":"-4/1","oracle_outcome":["8","8","3","8"],"oracle_proof_type":"explicit_enumeration_v1","oracle_trust_level":"P1_FULLY_CHECKABLE","pool_size_after":3,"pool_size_before":2,"restricted_margin":"1/1","restricted_weights":["0/1","0/1","0/1","1/1"],"weights":["0/1","0/1","1/1","0/1"]},{"added_difference":["1","1","1","-4"],"added_pool_index":3,"certificate_support":4,"dual_margin":"-1/4","iteration":4,"oracle_adapter":"explicit_enumeration_exact_v1","oracle_decision":{"id":"challenger_4"},"oracle_gap":"-4/1","oracle_outcome":["8","8","8","3"],"oracle_proof_type":"explicit_enumeration_v1","oracle_trust_level":"P1_FULLY_CHECKABLE","pool_size_after":4,"pool_size_before":3,"restricted_margin":"-1/4","restricted_weights":["1/4","1/4","1/4","1/4"],"termination":"negative_sparse_witness","weights":["0/1","0/1","0/1","1/1"]}],"result":"nonnegative_weight_unsupported","schema_version":"1.0.0"}
